Hello,Hello World!
Hello,Hello World!
What where the major accomplishment during the reporting period?,There are some things I just don't know about yet.
hi,Is there a different way you can ask that?
hello,Hello World!
Hello,Hello World!
What where the major accomplishment during the reporting period?,I'm not sure about that.
Hello,Hello World!
what is love,love is all about you 
,I'm not sure about that.
Hello,Hello World!
What where the major accomplishment during the reporting period?,To show profeciency during work situations
what is love,love is all about you 
Hello,Hello World!
are there financial obligation or fees for graduation?,there may be financial obligation or fees associated with graduation.
Graduating Student Question,I will have to give that some thought.
is there a minimum GPA needed?,"yes, there have need GPA for graduation."
